content,count
"Sanofinin salk sektöründe katma deer yaratacak yenilikçi fikirlerin geliimine destek olmak için Endeavor ile birlikte hayata geçirdii Giriimcilik Program PharmUpn 6. dönem bavurular balad.
Türkiyeni… [+1209 chars]",1
"Cumhurbakanl Savunma Sanayii Bakanl (SSB) liderliindeki Türk savunma sanayisi firmalar, 17-21 ubat'ta Birleik Arap Emirlikleri'nin bakenti Abu Dabi'de gerçekletirilecek IDEX ve NAVDEX 2025 Uluslarara… [+3978 chars]",1
"p class=""""&gt;ngiltere'de yaayan tek yumurta ikizleri Ross ve Hugo Turner çok çarpc bir deneye imza att. 12 hafta boyunca çok farkl beslenme modelleri benimseyen kardeler, elde ettikleri sonuçlara ke… [+7406 chars]",1
"a').click(); event.preventDefault();""&gt;Tam Boyutta GörReuters'n haberine göre, Çinli BYD, Türkiye'de ve Macaristan'da kuraca fabrikalara tedarikçi bulmak için talyan parça üreticilerinin kapsn çalm… [+1234 chars]",1
"WhatsApp durum güncellemelerinin, Instagram ve Facebook üzerinde paylalabileceini geçtiimiz haftalarda sizlere aktarmtk. Meta imdi de WhatsApp'ta kullanclarn sosyal medya hesaplarn mesajlama uygulama… [+1545 chars]",1
"ABD Bakan Donald Trumpn finansal paya sahip olduu yeni kripto platformu World Liberty Financial (WLF), Bitcoin, Ethereum ve dier kripto paralar güçlendirecek ekilde tasarlanm stratejik bir token reze… [+2089 chars]",1
"Oyuncu bilgisayarları ve aksesuarları ile tanıdığımız Monster, bir süre önce Pusat markasıyla oyuncu odaklı bilgisayar aksesuarları geliştirmiye başlamıştı. Monster şimdi Pusat ailesinde kullandığı y… [+916 chars]",1
"a').click(); event.preventDefault();""&gt;Tam Boyutta GörLondra merkezli Rho Motion, Ocak ayna ilikin küresel elektrikli araç sat rakamlarn yaynlad. Buna göre Ocak'ta geçtiimiz senenin ayn ayna göre %… [+1331 chars]",1
"müterilerine çok daha hzl yantlar vermek için üretken yapay zekâdan faydalandn vurgulayan Vodafone Businessn sat ve destek ekipleri, yenilikçi teknoloji metodolojisi olan ve bilgi bankas üzerinde çal… [+1201 chars]",1
"Güney Kore’nin önde gelen bilim ve teknoloji üniversitelerinden biri olan KAIST'te (Korea Advanced Institute of Science and Technology) bilim insanlar, tam kanser geliiminden önceki kritik geçi durum… [+2337 chars]",1
